[
  {
    "schemaVersion": "kaoyan-existing-sentence-1.0",
    "source": "production",
    "articleKey": "ky-en1-2026-r-t3",
    "location": {
      "paragraph": 1,
      "sentence": 1,
      "ps": "P1-S1"
    },
    "sourceLocator": {
      "sIndex": 1,
      "id": "P1-S1",
      "pIndex": 1
    },
    "text": "The pioneers of wireless saw it as a gift to all the people. Sir John Reith said that it would end \"isolation of the spirit\" and rejoiced: \"It does not matter how many thousands may be listening, there is always enough for others… the genius and the fool, the wealthy and the poor listen simultaneously.\"",
    "translation": "早期无线电广播的先驱们将其由衷视为一项馈赠给全人类所有人的崇高礼物。约翰·里斯爵士（Sir John Reith）曾满怀激情地断言，无线电广播将彻底终结“人类心灵的孤独隔绝”，并欣喜若狂地赞叹道：“无论此刻已有成千上万人在同时收听，它所蕴含的信息养分对于其他人来说永远充裕丰盛……无论是绝顶天才还是懵懂愚人，无论是豪门巨富还是赤贫寒士，都能在同一时刻毫无门槛地平等收听（wireless was accessible to everyone）！”",
    "syntaxAnalysis": null,
    "rawFields": {
      "isTopicSentence": true,
      "isKeyEvidence": true
    },
    "provenance": {
      "sourceLayer": "production",
      "sourceFile": "题库/英语/data_2026.js",
      "year": 2026,
      "articleKey": "ky-en1-2026-r-t3",
      "extractedAt": "2026-09-18T23:13:00+0800",
      "contentHash": "sha256:8d1f6a54cc35e229ff5263241e66befa252623694c56573725eea35fd3af84e8"
    }
  },
  {
    "schemaVersion": "kaoyan-existing-sentence-1.0",
    "source": "production",
    "articleKey": "ky-en1-2026-r-t3",
    "location": {
      "paragraph": 2,
      "sentence": 1,
      "ps": "P2-S1"
    },
    "sourceLocator": {
      "sIndex": 1,
      "id": "P2-S1",
      "pIndex": 2
    },
    "text": "Between two great wars this technological innovation built a new kind of national consciousness. Opening this week, a book and exhibition curated by Beatty Rubens at the Bodleian in Oxford records how radio changed everyday life from 1922 to 1939. She draws on letters, diaries and fiction, and a 1939 field notebook of verbatim audience research by Winifred Gill.",
    "translation": "在两次世界大战之间的风云岁月里，这项伟大的技术创新成功铸就了一种全新的国民共同体意识。本周在牛津大学博德利图书馆（Bodleian in Oxford）正式开展的一场由贝蒂·鲁本斯精心策划的专著出版与历史文献展览，翔实记录了无线电广播在1922年至1939年期间如何深刻颠覆改变了早期公众的日常生活（theme is the impact of radio on its early audience）。她广泛调阅了当年的书信、私人日记、文学小说，以及由威妮弗雷德·吉尔于1939年开展的一线受众逐字逐句田野调研笔记。",
    "syntaxAnalysis": null,
    "rawFields": {
      "isTopicSentence": true,
      "isKeyEvidence": true
    },
    "provenance": {
      "sourceLayer": "production",
      "sourceFile": "题库/英语/data_2026.js",
      "year": 2026,
      "articleKey": "ky-en1-2026-r-t3",
      "extractedAt": "2026-09-18T23:13:00+0800",
      "contentHash": "sha256:8d1f6a54cc35e229ff5263241e66befa252623694c56573725eea35fd3af84e8"
    }
  },
  {
    "schemaVersion": "kaoyan-existing-sentence-1.0",
    "source": "production",
    "articleKey": "ky-en1-2026-r-t3",
    "location": {
      "paragraph": 3,
      "sentence": 1,
      "ps": "P3-S1"
    },
    "sourceLocator": {
      "sIndex": 1,
      "id": "P3-S1",
      "pIndex": 3
    },
    "text": "There's fun in testimonies of people enjoying the sheer newness. A cartoon mocks a group failing to converse because they're all in headphones. People report that broad music made workmen whistle new tunes. A woman says there have been fewer street fights since the arrival of the wireless but also less stopping and \"talking on the brush handle\".",
    "translation": "在当年普通人尽情享受这一纯粹新奇体验的鲜活证言中充满了无尽乐趣：一幅讽刺漫画幽默嘲弄了一群人因为各自戴着笨重耳机而无法彼此交流；有记录显示，广播音乐让流水线工人们随口吹出各种全新的动听口哨曲调；一位家庭主妇甚至反映，自从无线电广播走进千家万户之后，街头的争吵斗殴明显减少了，但邻里之间停下脚步“靠在扫帚把上闲聊家常”（talking on the brush handle / having a casual chat）的温馨场景也同样变少了。",
    "syntaxAnalysis": null,
    "rawFields": {
      "isTopicSentence": true,
      "isKeyEvidence": true
    },
    "provenance": {
      "sourceLayer": "production",
      "sourceFile": "题库/英语/data_2026.js",
      "year": 2026,
      "articleKey": "ky-en1-2026-r-t3",
      "extractedAt": "2026-09-18T23:13:00+0800",
      "contentHash": "sha256:8d1f6a54cc35e229ff5263241e66befa252623694c56573725eea35fd3af84e8"
    }
  },
  {
    "schemaVersion": "kaoyan-existing-sentence-1.0",
    "source": "production",
    "articleKey": "ky-en1-2026-r-t3",
    "location": {
      "paragraph": 4,
      "sentence": 1,
      "ps": "P4-S1"
    },
    "sourceLocator": {
      "sIndex": 1,
      "id": "P4-S1",
      "pIndex": 4
    },
    "text": "By and large the wireless was welcome. I loved the man from the Thirties research who found that wireless suddenly offered \"a lot of variety… things I thought I'd never be interested in… ice hockey, perhaps\".",
    "translation": "总体而言，无线电广播在当年受到了全社会最热烈的欢迎。我由衷喜爱30年代受众调研中那位普通男子的生动感言——他惊喜地发现广播突然为他展现了“极其纷繁多样的广阔世界……许多我曾以为自己这辈子绝不会感兴趣的事物，比如冰球比赛，如今竟然听得津津有味”。",
    "syntaxAnalysis": null,
    "rawFields": {
      "isTopicSentence": true,
      "isKeyEvidence": false
    },
    "provenance": {
      "sourceLayer": "production",
      "sourceFile": "题库/英语/data_2026.js",
      "year": 2026,
      "articleKey": "ky-en1-2026-r-t3",
      "extractedAt": "2026-09-18T23:13:00+0800",
      "contentHash": "sha256:8d1f6a54cc35e229ff5263241e66befa252623694c56573725eea35fd3af84e8"
    }
  },
  {
    "schemaVersion": "kaoyan-existing-sentence-1.0",
    "source": "production",
    "articleKey": "ky-en1-2026-r-t3",
    "location": {
      "paragraph": 4,
      "sentence": 2,
      "ps": "P4-S2"
    },
    "sourceLocator": {
      "sIndex": 2,
      "id": "P4-S2",
      "pIndex": 4
    },
    "text": "True: for more than 80 pre-digital years, linear speech broadcasting brought the gift of serendipity, random enlivening of a car journey or dull manual task. In my own book about radio I recorded how, on one drive: \"I caught up with the news, learnt some 17th-century history, and was startlingly educated by an unpretentious programme on the history of the stethoscope.\"",
    "translation": "确实如此：在数字化时代降临前长达80多年的漫长岁月里，传统的“线性语言广播”为世人带来了不可多得的“意外收获与偶得惊喜之礼”（gift of serendipity / radio listeners could make unexpected gains）——它能够随机点亮枯燥乏味的驾车旅途或单调繁重的手工劳作。在我自己撰写的关于广播历史的专著中，我就曾深情记录下自己在一次驱车途中的真实奇遇：“我不仅顺畅跟进了时事新闻，意外学到了17世纪的历史知识，更被一档关于听诊器发明史的质朴无华节目深深启迪，获得了令人惊叹的意外新知！”",
    "syntaxAnalysis": null,
    "rawFields": {
      "isTopicSentence": false,
      "isKeyEvidence": true
    },
    "provenance": {
      "sourceLayer": "production",
      "sourceFile": "题库/英语/data_2026.js",
      "year": 2026,
      "articleKey": "ky-en1-2026-r-t3",
      "extractedAt": "2026-09-18T23:13:00+0800",
      "contentHash": "sha256:8d1f6a54cc35e229ff5263241e66befa252623694c56573725eea35fd3af84e8"
    }
  },
  {
    "schemaVersion": "kaoyan-existing-sentence-1.0",
    "source": "production",
    "articleKey": "ky-en1-2026-r-t3",
    "location": {
      "paragraph": 5,
      "sentence": 1,
      "ps": "P5-S1"
    },
    "sourceLocator": {
      "sIndex": 1,
      "id": "P5-S1",
      "pIndex": 5
    },
    "text": "But radio's enriching serendipity is ebbing. With multiple networks and countless podcasts, a smartphone user selects what to hear and when. And while it is wonderful to take a walk with anything in your headphones, infinite choice encourages us to shrink into niche interests and sympathetic beliefs.",
    "translation": "然而令人唏嘘的是，广播曾赋予人类的那种丰盈充沛的“意外惊喜”（serendipity），如今却在悄然退潮消逝。面对层出不穷的网络流媒体与数不胜数的个性化播客，智能手机用户只按个人偏好精准筛选何时收听何种特定内容。诚然，戴着耳机漫步收听自己所爱固然美妙；但这种看似无限的自由选择，却在无形中诱导促使我们将自己紧紧蜷缩退缩到狭隘的小众利基兴趣以及单一同温层的固有偏见信念之中（people should adopt a sensible attitude to innovations / shrink into niche beliefs）！",
    "syntaxAnalysis": null,
    "rawFields": {
      "isTopicSentence": true,
      "isKeyEvidence": true
    },
    "provenance": {
      "sourceLayer": "production",
      "sourceFile": "题库/英语/data_2026.js",
      "year": 2026,
      "articleKey": "ky-en1-2026-r-t3",
      "extractedAt": "2026-09-18T23:13:00+0800",
      "contentHash": "sha256:8d1f6a54cc35e229ff5263241e66befa252623694c56573725eea35fd3af84e8"
    }
  }
]